title,year,duration,rating,directors,stars
The Shawshank Redemption,1994,2h 22m,9.3,Frank Darabont,"Tim Robbins, Morgan Freeman, Bob Gunton"
The Godfather,1972,2h 55m,9.2,Francis Ford Coppola,"Marlon Brando, Al Pacino, James Caan"
The Dark Knight,2008,2h 32m,9.1,Christopher Nolan,"Christian Bale, Heath Ledger, Aaron Eckhart"
The Godfather Part II,1974,3h 22m,9.0,Francis Ford Coppola,"Al Pacino, Robert De Niro, Robert Duvall"
12 Angry Men,1957,1h 36m,9.0,Sidney Lumet,"Henry Fonda, Lee J. Cobb, Martin Balsam"
The Lord of the Rings: The Return of the King,2003,3h 21m,9.0,Peter Jackson,"Elijah Wood, Viggo Mortensen, Ian McKellen"
Schindler's List,1993,3h 15m,9.0,Steven Spielberg,"Liam Neeson, Ralph Fiennes, Ben Kingsley"
The Lord of the Rings: The Fellowship of the Ring,2001,2h 58m,8.9,Peter Jackson,"Elijah Wood, Ian McKellen, Orlando Bloom"
Pulp Fiction,1994,2h 34m,8.8,Quentin Tarantino,"John Travolta, Uma Thurman, Samuel L. Jackson"
"The Good, the Bad and the Ugly",1966,2h 58m,8.8,Sergio Leone,"Clint Eastwood, Eli Wallach, Lee Van Cleef"
The Lord of the Rings: The Two Towers,2002,2h 59m,8.8,Peter Jackson,"Elijah Wood, Ian McKellen, Viggo Mortensen"
Forrest Gump,1994,2h 22m,8.8,Robert Zemeckis,"Tom Hanks, Robin Wright, Gary Sinise"
Fight Club,1999,2h 19m,8.8,David Fincher,"Brad Pitt, Edward Norton, Meat Loaf"
Inception,2010,2h 28m,8.8,Christopher Nolan,"Leonardo DiCaprio, Joseph Gordon-Levitt, Elliot Page"
Star Wars: Episode V - The Empire Strikes Back,1980,2h 4m,8.7,Irvin Kershner,"Mark Hamill, Harrison Ford, Carrie Fisher"
The Matrix,1999,2h 16m,8.7,"Lana Wachowski, Lilly Wachowski","Keanu Reeves, Laurence Fishburne, Carrie-Anne Moss"
Goodfellas,1990,2h 25m,8.7,Martin Scorsese,"Robert De Niro, Ray Liotta, Joe Pesci"
Interstellar,2014,2h 49m,8.7,Christopher Nolan,"Matthew McConaughey, Anne Hathaway, Jessica Chastain"
One Flew Over the Cuckoo's Nest,1975,2h 13m,8.6,Milos Forman,"Jack Nicholson, Louise Fletcher, Michael Berryman"
Se7en,1995,2h 7m,8.6,David Fincher,"Morgan Freeman, Brad Pitt, Kevin Spacey"
It's a Wonderful Life,1946,2h 10m,8.6,Frank Capra,"James Stewart, Donna Reed, Lionel Barrymore"
The Silence of the Lambs,1991,1h 58m,8.6,Jonathan Demme,"Jodie Foster, Anthony Hopkins, Scott Glenn"
Seven Samurai,1954,3h 27m,8.6,Akira Kurosawa,"Toshirô Mifune, Takashi Shimura, Keiko Tsushima"
Saving Private Ryan,1998,2h 49m,8.6,Steven Spielberg,"Tom Hanks, Matt Damon, Tom Sizemore"
The Green Mile,1999,3h 9m,8.6,Frank Darabont,"Tom Hanks, Michael Clarke Duncan, David Morse"
City of God,2002,2h 10m,8.6,"Kátia Lund, Fernando Meirelles","Alexandre Rodrigues, Leandro Firmino, Matheus Nachtergaele"
Life Is Beautiful,1997,1h 56m,8.6,Roberto Benigni,"Roberto Benigni, Nicoletta Braschi, Giorgio Cantarini"
Terminator 2: Judgment Day,1991,2h 17m,8.6,James Cameron,"Arnold Schwarzenegger, Linda Hamilton, Edward Furlong"
Star Wars: Episode IV - A New Hope,1977,2h 1m,8.6,George Lucas,"Mark Hamill, Harrison Ford, Carrie Fisher"
Back to the Future,1985,1h 56m,8.5,Robert Zemeckis,"Michael J. Fox, Christopher Lloyd, Lea Thompson"
Spirited Away,2001,2h 4m,8.6,Hayao Miyazaki,"Daveigh Chase, Suzanne Pleshette, Miyu Irino"
The Pianist,2002,2h 30m,8.5,Roman Polanski,"Adrien Brody, Thomas Kretschmann, Frank Finlay"
Gladiator,2000,2h 35m,8.5,Ridley Scott,"Russell Crowe, Joaquin Phoenix, Connie Nielsen"
Parasite,2019,2h 12m,8.5,Bong Joon Ho,"Song Kang-ho, Lee Sun-kyun, Cho Yeo-jeong"
Psycho,1960,1h 49m,8.5,Alfred Hitchcock,"Anthony Perkins, Janet Leigh, Vera Miles"
Grave of the Fireflies,1988,1h 28m,8.5,Isao Takahata,"Tsutomu Tatsumi, Ayano Shiraishi, Akemi Yamaguchi"
The Lion King,1994,1h 28m,8.5,"Roger Allers, Rob Minkoff","Matthew Broderick, Jeremy Irons, James Earl Jones"
Harakiri,1962,2h 13m,8.6,Masaki Kobayashi,"Tatsuya Nakadai, Akira Ishihama, Shima Iwashita"
The Departed,2006,2h 31m,8.5,Martin Scorsese,"Leonardo DiCaprio, Matt Damon, Jack Nicholson"
Whiplash,2014,1h 46m,8.5,Damien Chazelle,"Miles Teller, J.K. Simmons, Melissa Benoist"
The Prestige,2006,2h 10m,8.5,Christopher Nolan,"Christian Bale, Hugh Jackman, Scarlett Johansson"
American History X,1998,1h 59m,8.5,Tony Kaye,"Edward Norton, Edward Furlong, Beverly D'Angelo"
Léon: The Professional,1994,1h 50m,8.5,Luc Besson,"Jean Reno, Gary Oldman, Natalie Portman"
Spider-Man: Across the Spider-Verse,2023,2h 20m,8.5,"Joaquim Dos Santos, Kemp Powers, Justin K. Thompson","Shameik Moore, Hailee Steinfeld, Brian Tyree Henry"
Cinema Paradiso,1988,2h 54m,8.5,Giuseppe Tornatore,"Philippe Noiret, Enzo Cannavale, Antonella Attili"
Casablanca,1942,1h 42m,8.5,Michael Curtiz,"Humphrey Bogart, Ingrid Bergman, Paul Henreid"
The Intouchables,2011,1h 52m,8.5,"Olivier Nakache, Éric Toledano","François Cluzet, Omar Sy, Anne Le Ny"
The Usual Suspects,1995,1h 46m,8.5,Bryan Singer,"Kevin Spacey, Gabriel Byrne, Chazz Palminteri"
Alien,1979,1h 57m,8.5,Ridley Scott,"Sigourney Weaver, Tom Skerritt, John Hurt"
Modern Times,1936,1h 27m,8.5,Charles Chaplin,"Charles Chaplin, Paulette Goddard, Henry Bergman"
Rear Window,1954,1h 52m,8.5,Alfred Hitchcock,"James Stewart, Grace Kelly, Wendell Corey"
Django Unchained,2012,2h 45m,8.5,Quentin Tarantino,"Jamie Foxx, Christoph Waltz, Leonardo DiCaprio"
Once Upon a Time in the West,1968,2h 46m,8.5,Sergio Leone,"Henry Fonda, Charles Bronson, Claudia Cardinale"
City Lights,1931,1h 27m,8.5,Charles Chaplin,"Charles Chaplin, Virginia Cherrill, Florence Lee"
Apocalypse Now,1979,2h 27m,8.4,Francis Ford Coppola,"Martin Sheen, Marlon Brando, Robert Duvall"
WALL·E,2008,1h 38m,8.4,Andrew Stanton,"Ben Burtt, Elissa Knight, Jeff Garlin"
Memento,2000,1h 53m,8.4,Christopher Nolan,"Guy Pearce, Carrie-Anne Moss, Joe Pantoliano"
Dune: Part Two,2024,2h 46m,8.4,Denis Villeneuve,"Timothée Chalamet, Zendaya, Rebecca Ferguson"
Raiders of the Lost Ark,1981,1h 55m,8.4,Steven Spielberg,"Harrison Ford, Karen Allen, Paul Freeman"
Avengers: Infinity War,2018,2h 29m,8.4,"Anthony Russo, Joe Russo","Robert Downey Jr., Chris Hemsworth, Mark Ruffalo"
The Lives of Others,2006,2h 17m,8.4,Florian Henckel von Donnersmarck,"Ulrich Mühe, Martina Gedeck, Sebastian Koch"
Spider-Man: Into the Spider-Verse,2018,1h 57m,8.4,"Bob Persichetti, Peter Ramsey, Rodney Rothman","Shameik Moore, Jake Johnson, Hailee Steinfeld"
Sunset Boulevard,1950,1h 50m,8.4,Billy Wilder,"William Holden, Gloria Swanson, Erich von Stroheim"
Witness for the Prosecution,1957,1h 56m,8.4,Billy Wilder,"Tyrone Power, Marlene Dietrich, Charles Laughton"
Paths of Glory,1957,1h 28m,8.4,Stanley Kubrick,"Kirk Douglas, Ralph Meeker, Adolphe Menjou"
The Shining,1980,2h 26m,8.4,Stanley Kubrick,"Jack Nicholson, Shelley Duvall, Danny Lloyd"
The Great Dictator,1940,2h 5m,8.4,Charles Chaplin,"Charles Chaplin, Paulette Goddard, Jack Oakie"
Inglourious Basterds,2009,2h 33m,8.4,Quentin Tarantino,"Brad Pitt, Diane Kruger, Eli Roth"
Aliens,1986,2h 17m,8.4,James Cameron,"Sigourney Weaver, Michael Biehn, Carrie Henn"
12th Fail,2023,2h 27m,8.7,Vidhu Vinod Chopra,"Vikrant Massey, Medha Shankr, Anant Joshi"
High and Low,1963,2h 23m,8.4,Akira Kurosawa,"Toshirô Mifune, Yutaka Sada, Tatsuya Nakadai"
The Dark Knight Rises,2012,2h 44m,8.4,Christopher Nolan,"Christian Bale, Tom Hardy, Anne Hathaway"
Coco,2017,1h 45m,8.4,"Adrian Molina, Lee Unkrich","Anthony Gonzalez, Gael García Bernal, Benjamin Bratt"
Avengers: Endgame,2019,3h 1m,8.4,"Anthony Russo, Joe Russo","Robert Downey Jr., Chris Evans, Mark Ruffalo"
Amadeus,1984,2h 40m,8.4,Milos Forman,"F. Murray Abraham, Tom Hulce, Elizabeth Berridge"
Good Will Hunting,1997,2h 6m,8.3,Gus Van Sant,"Robin Williams, Matt Damon, Ben Affleck"
Toy Story,1995,1h 21m,8.3,John Lasseter,"Tom Hanks, Tim Allen, Don Rickles"
Your Name.,2016,1h 46m,8.4,Makoto Shinkai,"Ryûnosuke Kamiki, Mone Kamishiraishi, Ryo Narita"
Das Boot,1981,2h 29m,8.4,Wolfgang Petersen,"Jürgen Prochnow, Herbert Grönemeyer, Klaus Wennemann"
Oldboy,2003,2h,8.3,Park Chan-wook,"Choi Min-sik, Yoo Ji-tae, Kang Hye-jeong"
Strangelove or: How I Learned to Stop Worrying and Love the Bomb,1964,1h 35m,8.3,Stanley Kubrick,"Peter Sellers, George C. Scott, Sterling Hayden"
Braveheart,1995,2h 58m,8.3,Mel Gibson,"Mel Gibson, Sophie Marceau, Patrick McGoohan"
Princess Mononoke,1997,2h 13m,8.3,Hayao Miyazaki,"Yôji Matsuda, Yuriko Ishida, Yûko Tanaka"
American Beauty,1999,2h 2m,8.3,Sam Mendes,"Kevin Spacey, Annette Bening, Thora Birch"
3 Idiots,2009,2h 50m,8.4,Rajkumar Hirani,"Aamir Khan, Madhavan, Mona Singh"
Capernaum,2018,2h 6m,8.4,Nadine Labaki,"Zain Al Rafeea, Yordanos Shiferaw, Boluwatife Treasure Bankole"
Joker,2019,2h 2m,8.3,Todd Phillips,"Joaquin Phoenix, Robert De Niro, Zazie Beetz"
Once Upon a Time in America,1984,3h 49m,8.3,Sergio Leone,"Robert De Niro, James Woods, Elizabeth McGovern"
Singin' in the Rain,1952,1h 43m,8.3,"Stanley Donen, Gene Kelly","Gene Kelly, Donald O'Connor, Debbie Reynolds"
Come and See,1985,2h 22m,8.3,Elem Klimov,"Aleksey Kravchenko, Olga Mironova, Liubomiras Laucevicius"
Requiem for a Dream,2000,1h 42m,8.3,Darren Aronofsky,"Ellen Burstyn, Jared Leto, Jennifer Connelly"
Star Wars: Episode VI - Return of the Jedi,1983,2h 11m,8.3,Richard Marquand,"Mark Hamill, Harrison Ford, Carrie Fisher"
Toy Story 3,2010,1h 43m,8.3,Lee Unkrich,"Tom Hanks, Tim Allen, Joan Cusack"
The Hunt,2012,1h 55m,8.3,Thomas Vinterberg,"Mads Mikkelsen, Thomas Bo Larsen, Annika Wedderkopp"
Ikiru,1952,2h 23m,8.3,Akira Kurosawa,"Takashi Shimura, Nobuo Kaneko, Shin'ichi Himori"
Eternal Sunshine of the Spotless Mind,2004,1h 48m,8.3,Michel Gondry,"Jim Carrey, Kate Winslet, Tom Wilkinson"
Incendies,2010,2h 11m,8.3,Denis Villeneuve,"Lubna Azabal, Mélissa Désormeaux-Poulin, Maxim Gaudette"
The Apartment,1960,2h 5m,8.3,Billy Wilder,"Jack Lemmon, Shirley MacLaine, Fred MacMurray"
Lawrence of Arabia,1962,3h 47m,8.3,David Lean,"Peter O'Toole, Alec Guinness, Anthony Quinn"
2001: A Space Odyssey,1968,2h 29m,8.3,Stanley Kubrick,"Keir Dullea, Gary Lockwood, William Sylvester"
Reservoir Dogs,1992,1h 39m,8.3,Quentin Tarantino,"Harvey Keitel, Tim Roth, Michael Madsen"
Scarface,1983,2h 50m,8.3,Brian De Palma,"Al Pacino, Michelle Pfeiffer, Steven Bauer"
Heat,1995,2h 50m,8.3,Michael Mann,"Al Pacino, Robert De Niro, Val Kilmer"
Double Indemnity,1944,1h 47m,8.3,Billy Wilder,"Fred MacMurray, Barbara Stanwyck, Edward G. Robinson"
Up,2009,1h 36m,8.3,"Pete Docter, Bob Peterson","Edward Asner, Jordan Nagai, John Ratzenberger"
North by Northwest,1959,2h 16m,8.3,Alfred Hitchcock,"Cary Grant, Eva Marie Saint, James Mason"
M,1931,1h 39m,8.3,Fritz Lang,"Peter Lorre, Ellen Widmann, Inge Landgut"
Full Metal Jacket,1987,1h 56m,8.2,Stanley Kubrick,"Matthew Modine, R. Lee Ermey, Vincent D'Onofrio"
Citizen Kane,1941,1h 59m,8.2,Orson Welles,"Orson Welles, Joseph Cotten, Dorothy Comingore"
Like Stars on Earth,2007,2h 42m,8.3,Aamir Khan,"Darsheel Safary, Aamir Khan, Tisca Chopra"
Amélie,2001,2h 2m,8.3,Jean-Pierre Jeunet,"Audrey Tautou, Mathieu Kassovitz, Rufus"
Vertigo,1958,2h 8m,8.2,Alfred Hitchcock,"James Stewart, Kim Novak, Barbara Bel Geddes"
A Separation,2011,2h 3m,8.3,Asghar Farhadi,"Payman Maadi, Leila Hatami, Sareh Bayat"
Die Hard,1988,2h 12m,8.2,John McTiernan,"Bruce Willis, Alan Rickman, Bonnie Bedelia"
To Kill a Mockingbird,1962,2h 9m,8.3,Robert Mulligan,"Gregory Peck, John Megna, Frank Overton"
Indiana Jones and the Last Crusade,1989,2h 7m,8.2,Steven Spielberg,"Harrison Ford, Sean Connery, Alison Doody"
The Sting,1973,2h 9m,8.2,George Roy Hill,"Paul Newman, Robert Redford, Robert Shaw"
A Clockwork Orange,1971,2h 16m,8.2,Stanley Kubrick,"Malcolm McDowell, Patrick Magee, Michael Bates"
Metropolis,1927,2h 33m,8.2,Fritz Lang,"Brigitte Helm, Alfred Abel, Gustav Fröhlich"
Snatch,2000,1h 42m,8.2,Guy Ritchie,"Jason Statham, Brad Pitt, Stephen Graham"
1917,2019,1h 59m,8.2,Sam Mendes,"Dean-Charles Chapman, George MacKay, Daniel Mays"
Confidential,1997,2h 18m,8.2,Curtis Hanson,"Kevin Spacey, Russell Crowe, Guy Pearce"
Oppenheimer,2023,3h,8.3,Christopher Nolan,"Cillian Murphy, Emily Blunt, Matt Damon"
Downfall,2004,2h 36m,8.2,Oliver Hirschbiegel,"Bruno Ganz, Alexandra Maria Lara, Ulrich Matthes"
Bicycle Thieves,1948,1h 29m,8.2,Vittorio De Sica,"Lamberto Maggiorani, Enzo Staiola, Lianella Carell"
Dangal,2016,2h 41m,8.3,Nitesh Tiwari,"Aamir Khan, Sakshi Tanwar, Fatima Sana Shaikh"
The Wolf of Wall Street,2013,3h,8.2,Martin Scorsese,"Leonardo DiCaprio, Jonah Hill, Margot Robbie"
The Truman Show,1998,1h 43m,8.2,Peter Weir,"Jim Carrey, Ed Harris, Laura Linney"
Green Book,2018,2h 10m,8.2,Peter Farrelly,"Viggo Mortensen, Mahershala Ali, Linda Cardellini"
Hamilton,2020,2h 40m,8.3,Thomas Kail,"Lin-Manuel Miranda, Phillipa Soo, Leslie Odom Jr."
Batman Begins,2005,2h 20m,8.2,Christopher Nolan,"Christian Bale, Michael Caine, Ken Watanabe"
Judgment at Nuremberg,1961,2h 59m,8.3,Stanley Kramer,"Spencer Tracy, Burt Lancaster, Richard Widmark"
Taxi Driver,1976,1h 54m,8.2,Martin Scorsese,"Robert De Niro, Jodie Foster, Cybill Shepherd"
Shutter Island,2010,2h 18m,8.2,Martin Scorsese,"Leonardo DiCaprio, Emily Mortimer, Mark Ruffalo"
For a Few Dollars More,1965,2h 12m,8.2,Sergio Leone,"Clint Eastwood, Lee Van Cleef, Gian Maria Volontè"
Some Like It Hot,1959,2h 1m,8.2,Billy Wilder,"Marilyn Monroe, Tony Curtis, Jack Lemmon"
Jurassic Park,1993,2h 7m,8.2,Steven Spielberg,"Sam Neill, Laura Dern, Jeff Goldblum"
There Will Be Blood,2007,2h 38m,8.2,Paul Thomas Anderson,"Daniel Day-Lewis, Paul Dano, Ciarán Hinds"
The Kid,1921,1h 8m,8.2,Charles Chaplin,"Charles Chaplin, Edna Purviance, Jackie Coogan"
The Father,2020,1h 37m,8.2,Florian Zeller,"Anthony Hopkins, Olivia Colman, Mark Gatiss"
All About Eve,1950,2h 18m,8.2,Joseph L. Mankiewicz,"Bette Davis, Anne Baxter, George Sanders"
The Sixth Sense,1999,1h 47m,8.2,M. Night Shyamalan,"Bruce Willis, Haley Joel Osment, Toni Collette"
Ran,1985,2h 40m,8.2,Akira Kurosawa,"Tatsuya Nakadai, Akira Terao, Jinpachi Nezu"
Casino,1995,2h 58m,8.2,Martin Scorsese,"Robert De Niro, Sharon Stone, Joe Pesci"
The Chaos Class Failed the Class,1975,1h 35m,8.6,Ertem Egilmez,"Münir Özkul, Tarik Akan, Kemal Sunal"
No Country for Old Men,2007,2h 2m,8.2,"Ethan Coen, Joel Coen","Tommy Lee Jones, Javier Bardem, Josh Brolin"
The Thing,1982,1h 49m,8.2,John Carpenter,"Kurt Russell, Wilford Brimley, Keith David"
Top Gun: Maverick,2022,2h 10m,8.2,Joseph Kosinski,"Tom Cruise, Jennifer Connelly, Miles Teller"
Pan's Labyrinth,2006,1h 58m,8.2,Guillermo del Toro,"Ivana Baquero, Ariadna Gil, Sergi López"
Unforgiven,1992,2h 10m,8.2,Clint Eastwood,"Clint Eastwood, Gene Hackman, Morgan Freeman"
Prisoners,2013,2h 33m,8.2,Denis Villeneuve,"Hugh Jackman, Jake Gyllenhaal, Viola Davis"
1,2003,1h 51m,8.2,Quentin Tarantino,"Uma Thurman, David Carradine, Daryl Hannah"
A Beautiful Mind,2001,2h 15m,8.2,Ron Howard,"Russell Crowe, Ed Harris, Jennifer Connelly"
The Treasure of the Sierra Madre,1948,2h 6m,8.2,John Huston,"Humphrey Bogart, Walter Huston, Tim Holt"
Howl's Moving Castle,2004,1h 59m,8.2,Hayao Miyazaki,"Chieko Baishô, Takuya Kimura, Tatsuya Gashûin"
Finding Nemo,2003,1h 40m,8.2,"Andrew Stanton, Lee Unkrich","Albert Brooks, Ellen DeGeneres, Alexander Gould"
Yojimbo,1961,1h 50m,8.2,Akira Kurosawa,"Toshirô Mifune, Eijirô Tôno, Tatsuya Nakadai"
The Great Escape,1963,2h 52m,8.2,John Sturges,"Steve McQueen, James Garner, Richard Attenborough"
Monty Python and the Holy Grail,1975,1h 31m,8.2,"Terry Gilliam, Terry Jones","Graham Chapman, John Cleese, Eric Idle"
The Best of Youth,2003,6h 14m,8.4,Marco Tullio Giordana,"Luigi Lo Cascio, Alessio Boni, Jasmine Trinca"
The Elephant Man,1980,2h 4m,8.2,David Lynch,"Anthony Hopkins, John Hurt, Anne Bancroft"
Klaus,2019,1h 36m,8.2,"Carlos Martínez López, Sergio Pablos","Jason Schwartzman, J.K. Simmons, Rashida Jones"
Dial M for Murder,1954,1h 45m,8.2,Alfred Hitchcock,"Ray Milland, Grace Kelly, Robert Cummings"
Gone with the Wind,1939,3h 58m,8.2,Victor Fleming,"Clark Gable, Vivien Leigh, Thomas Mitchell"
The Secret in Their Eyes,2009,2h 9m,8.2,Juan José Campanella,"Ricardo Darín, Soledad Villamil, Pablo Rago"
Chinatown,1974,2h 10m,8.1,Roman Polanski,"Jack Nicholson, Faye Dunaway, John Huston"
"Lock, Stock and Two Smoking Barrels",1998,1h 47m,8.1,Guy Ritchie,"Jason Flemyng, Dexter Fletcher, Nick Moran"
V for Vendetta,2005,2h 12m,8.1,James McTeigue,"Hugo Weaving, Natalie Portman, Rupert Graves"
Demon Slayer: Kimetsu no Yaiba- The Movie - Infinity Castle,2025,2h 35m,8.5,"Hikaru Kondô, Haruo Sotozaki","Zach Aguilar, Saeko Akiho, Yôhei Azakami"
Inside Out,2015,1h 35m,8.1,"Ronnie Del Carmen, Pete Docter","Amy Poehler, Bill Hader, Lewis Black"
Rashomon,1950,1h 28m,8.1,Akira Kurosawa,"Toshirô Mifune, Machiko Kyô, Masayuki Mori"
Catch Me If You Can,2002,2h 21m,8.1,Steven Spielberg,"Leonardo DiCaprio, Tom Hanks, Christopher Walken"
"Three Billboards Outside Ebbing, Missouri",2017,1h 55m,8.1,Martin McDonagh,"Frances McDormand, Woody Harrelson, Sam Rockwell"
Trainspotting,1996,1h 33m,8.1,Danny Boyle,"Ewan McGregor, Ewen Bremner, Jonny Lee Miller"
The Bridge on the River Kwai,1957,2h 41m,8.1,David Lean,"William Holden, Alec Guinness, Jack Hawkins"
Harry Potter and the Deathly Hallows: Part 2,2011,2h 10m,8.1,David Yates,"Daniel Radcliffe, Emma Watson, Rupert Grint"
Raging Bull,1980,2h 9m,8.1,Martin Scorsese,"Robert De Niro, Cathy Moriarty, Joe Pesci"
Fargo,1996,1h 38m,8.1,"Joel Coen, Ethan Coen","William H. Macy, Frances McDormand, Steve Buscemi"
Warrior,2011,2h 20m,8.1,Gavin O'Connor,"Tom Hardy, Nick Nolte, Joel Edgerton"
Dead Poets Society,1989,2h 8m,8.1,Peter Weir,"Robin Williams, Robert Sean Leonard, Ethan Hawke"
The Wild Robot,2024,1h 42m,8.2,Chris Sanders,"Lupita Nyong'o, Pedro Pascal, Kit Connor"
Barry Lyndon,1975,3h 5m,8.1,Stanley Kubrick,"Ryan O'Neal, Marisa Berenson, Patrick Magee"
Ben-Hur,1959,3h 32m,8.1,William Wyler,"Charlton Heston, Jack Hawkins, Stephen Boyd"
Million Dollar Baby,2004,2h 12m,8.1,Clint Eastwood,"Hilary Swank, Clint Eastwood, Morgan Freeman"
Mad Max: Fury Road,2015,2h,8.1,George Miller,"Tom Hardy, Charlize Theron, Nicholas Hoult"
Gran Torino,2008,1h 56m,8.1,Clint Eastwood,"Clint Eastwood, Bee Vang, Christopher Carley"
My Neighbor Totoro,1988,1h 26m,8.1,Hayao Miyazaki,"Hitoshi Takagi, Noriko Hidaka, Chika Sakamoto"
Children of Heaven,1997,1h 29m,8.2,Majid Majidi,"Reza Naji, Amir Farrokh Hashemian, Bahare Seddiqi"
Hacksaw Ridge,2016,2h 19m,8.1,Mel Gibson,"Andrew Garfield, Sam Worthington, Luke Bracey"
The Grand Budapest Hotel,2014,1h 39m,8.1,Wes Anderson,"Ralph Fiennes, F. Murray Abraham, Mathieu Amalric"
12 Years a Slave,2013,2h 14m,8.1,Steve McQueen,"Chiwetel Ejiofor, Michael Kenneth Williams, Michael Fassbender"
Before Sunrise,1995,1h 41m,8.1,Richard Linklater,"Ethan Hawke, Julie Delpy, Andrea Eckert"
Blade Runner,1982,1h 57m,8.1,Ridley Scott,"Harrison Ford, Rutger Hauer, Sean Young"
Ratatouille,2007,1h 51m,8.1,"Brad Bird, Jan Pinkava","Brad Garrett, Lou Romano, Patton Oswalt"
Memories of Murder,2003,2h 12m,8.1,Bong Joon Ho,"Song Kang-ho, Kim Sang-kyung, Kim Roe-ha"
Spider-Man: No Way Home,2021,2h 28m,8.2,Jon Watts,"Tom Holland, Zendaya, Benedict Cumberbatch"
How to Train Your Dragon,2010,1h 38m,8.1,"Dean DeBlois, Chris Sanders","Jay Baruchel, Gerard Butler, Christopher Mintz-Plasse"
Gone Girl,2014,2h 29m,8.1,David Fincher,"Ben Affleck, Rosamund Pike, Neil Patrick Harris"
"Monsters, Inc.",2001,1h 32m,8.1,"Pete Docter, David Silverman, Lee Unkrich","Billy Crystal, John Goodman, Mary Gibbs"
Jaws,1975,2h 4m,8.1,Steven Spielberg,"Roy Scheider, Robert Shaw, Richard Dreyfuss"
In the Name of the Father,1993,2h 13m,8.1,Jim Sheridan,"Daniel Day-Lewis, Pete Postlethwaite, Anthony Brophy"
Ford v Ferrari,2019,2h 32m,8.1,James Mangold,"Matt Damon, Christian Bale, Jon Bernthal"
Wild Tales,2014,2h 2m,8.1,Damián Szifron,"Darío Grandinetti, María Marull, Mónica Villa"
The Gold Rush,1925,1h 35m,8.1,Charles Chaplin,"Charles Chaplin, Mack Swain, Tom Murray"
Sherlock Jr.,1924,45m,8.1,Buster Keaton,"Buster Keaton, Kathryn McGuire, Joe Keaton"
Mary and Max,2009,1h 32m,8.1,Adam Elliot,"Toni Collette, Philip Seymour Hoffman, Eric Bana"
The Deer Hunter,1978,3h 3m,8.1,Michael Cimino,"Robert De Niro, Christopher Walken, John Cazale"
The Wages of Fear,1953,2h 36m,8.1,Henri-Georges Clouzot,"Yves Montand, Charles Vanel, Peter van Eyck"
The General,1926,1h 18m,8.1,"Clyde Bruckman, Buster Keaton","Buster Keaton, Marion Mack, Glen Cavender"
Logan,2017,2h 17m,8.1,James Mangold,"Hugh Jackman, Patrick Stewart, Dafne Keen"
Smith Goes to Washington,1939,2h 9m,8.1,Frank Capra,"James Stewart, Jean Arthur, Claude Rains"
Rocky,1976,2h,8.1,John G. Avildsen,"Sylvester Stallone, Talia Shire, Burt Young"
On the Waterfront,1954,1h 48m,8.1,Elia Kazan,"Marlon Brando, Karl Malden, Lee J. Cobb"
Tokyo Story,1953,2h 17m,8.1,Yasujirô Ozu,"Chishû Ryû, Chieko Higashiyama, Sô Yamamura"
Wild Strawberries,1957,1h 32m,8.1,Ingmar Bergman,"Victor Sjöström, Bibi Andersson, Ingrid Thulin"
Pirates of the Caribbean: The Curse of the Black Pearl,2003,2h 23m,8.1,Gore Verbinski,"Johnny Depp, Geoffrey Rush, Orlando Bloom"
The Third Man,1949,1h 44m,8.1,Carol Reed,"Orson Welles, Joseph Cotten, Alida Valli"
Spotlight,2015,2h 9m,8.1,Tom McCarthy,"Mark Ruffalo, Michael Keaton, Rachel McAdams"
Maharaja,2024,2h 21m,8.3,Nithilan Saminathan,"Vijay Sethupathi, Anurag Kashyap, Mamta Mohandas"
La haine,1995,1h 38m,8.1,Mathieu Kassovitz,"Vincent Cassel, Hubert Koundé, Saïd Taghmaoui"
The Terminator,1984,1h 47m,8.1,James Cameron,"Arnold Schwarzenegger, Linda Hamilton, Michael Biehn"
Jai Bhim,2021,2h 44m,8.6,T.J. Gnanavel,"Suriya, Lijo Mol Jose, Manikandan K."
The Big Lebowski,1998,1h 57m,8.1,"Joel Coen, Ethan Coen","Jeff Bridges, John Goodman, Julianne Moore"
The Sound of Music,1965,2h 54m,8.1,Robert Wise,"Julie Andrews, Christopher Plummer, Eleanor Parker"
The Seventh Seal,1957,1h 36m,8.1,Ingmar Bergman,"Max von Sydow, Gunnar Björnstrand, Bengt Ekerot"
Room,2015,1h 58m,8.1,Lenny Abrahamson,"Brie Larson, Jacob Tremblay, Sean Bridgers"
The Best Years of Our Lives,1946,2h 50m,8.1,William Wyler,"Myrna Loy, Dana Andrews, Fredric March"
A Silent Voice: The Movie,2016,2h 10m,8.2,Naoko Yamada,"Miyu Irino, Saori Hayami, Aoi Yûki"
Platoon,1986,2h,8.1,Oliver Stone,"Charlie Sheen, Tom Berenger, Willem Dafoe"
Hotel Rwanda,2004,2h 1m,8.1,Terry George,"Don Cheadle, Sophie Okonedo, Joaquin Phoenix"
Before Sunset,2004,1h 20m,8.1,Richard Linklater,"Ethan Hawke, Julie Delpy, Vernon Dobtcheff"
The Incredibles,2004,1h 55m,8.0,Brad Bird,"Craig T. Nelson, Samuel L. Jackson, Holly Hunter"
The Exorcist,1973,2h 2m,8.1,William Friedkin,"Ellen Burstyn, Max von Sydow, Linda Blair"
Hachi: A Dog's Tale,2009,1h 33m,8.1,Lasse Hallström,"Richard Gere, Joan Allen, Cary-Hiroyuki Tagawa"
The Wizard of Oz,1939,1h 42m,8.1,Victor Fleming,"Judy Garland, Frank Morgan, Ray Bolger"
Rush,2013,2h 3m,8.1,Ron Howard,"Daniel Brühl, Chris Hemsworth, Olivia Wilde"
The Passion of Joan of Arc,1928,1h 54m,8.1,Carl Theodor Dreyer,"Maria Falconetti, Eugene Silvain, André Berley"
Stand by Me,1986,1h 29m,8.1,Rob Reiner,"Wil Wheaton, River Phoenix, Corey Feldman"
The Iron Giant,1999,1h 26m,8.1,Brad Bird,"Eli Marienthal, Harry Connick Jr., Jennifer Aniston"
My Father and My Son,2005,1h 52m,8.2,Çagan Irmak,"Çetin Tekindor, Fikret Kuskan, Hümeyra"
The Battle of Algiers,1966,2h 1m,8.1,Gillo Pontecorvo,"Brahim Hadjadj, Jean Martin, Yacef Saadi"
The Handmaiden,2016,2h 25m,8.1,Park Chan-wook,"Kim Min-hee, Ha Jung-woo, Cho Jin-woong"
Network,1976,2h 1m,8.1,Sidney Lumet,"Faye Dunaway, William Holden, Peter Finch"
Demon Slayer: Kimetsu no Yaiba - The Movie: Mugen Train,2020,1h 57m,8.2,Haruo Sotozaki,"Natsuki Hanae, Akari Kitô, Yoshitsugu Matsuoka"
Gangs of Wasseypur,2012,5h 21m,8.2,Anurag Kashyap,"Manoj Bajpayee, Nawazuddin Siddiqui, Tigmanshu Dhulia"
The Grapes of Wrath,1940,2h 9m,8.1,John Ford,"Henry Fonda, Jane Darwell, John Carradine"
Drishyam,2015,2h 43m,8.2,Nishikant Kamat,"Ajay Devgn, Shriya Saran, Tabu"
To Be or Not to Be,1942,1h 39m,8.1,Ernst Lubitsch,"Carole Lombard, Jack Benny, Robert Stack"
Lost Ladies,2023,2h 2m,8.3,Kiran Rao,"Nitanshi Goel, Pratibha Ranta, Sparsh Shrivastava"
Autumn Sonata,1978,1h 39m,8.1,Ingmar Bergman,"Ingrid Bergman, Liv Ullmann, Lena Nyman"
